<?xml version="1.0" encoding="UTF-8"?>
<xsd:schema xmlns:xsd="http://www.w3.org/2001/XMLSchema" attributeFormDefault="qualified">
    <xsd:element name="classes">
        <xsd:complexType>
            <xsd:sequence>
                <xsd:element maxOccurs="unbounded" minOccurs="1" ref="cinterface"/>
            </xsd:sequence>
        </xsd:complexType>
    </xsd:element>
    <xsd:element name="cimplement">
        <xsd:complexType>
        	<xsd:sequence>
        		<xsd:element minOccurs="0" maxOccurs="unbounded" ref="init-parameter"></xsd:element>
        	</xsd:sequence>
            <xsd:attribute name="name" type="xsd:string" use="required"/>
        </xsd:complexType>
    </xsd:element>
    <xsd:element name="init-parameter" >
        <xsd:complexType mixed="true">
            <xsd:attribute name="name" type="xsd:string" use="required"/>
        </xsd:complexType>
    </xsd:element>
    <xsd:element name="cinterface">
        <xsd:complexType>
            <xsd:sequence>
                <xsd:element maxOccurs="unbounded" minOccurs="1" ref="cimplement"/>
            </xsd:sequence>
            <xsd:attribute name="name" type="xsd:string" use="required"/>
        </xsd:complexType>
    </xsd:element>
</xsd:schema>
